{
  "title": "what-happens-when-you-read-every-day",
  "aspect_ratio": "16:9",
  "style": "minimalist 2D line-art cartoon, thin ink outlines, flat muted pastel fills, soft shadows, high-key lighting, clean white background, educational animation style",
  "voice": { "name": "Brian", "speed": 0.95, "stability": 0.6 },
  "characters": [
    {
      "id": "A",
      "prompt": "Character reference sheet: young Black man in his early 20s wearing 1940s denim prison uniform, short hair, thoughtful intense expression — front view, side view, three expressions (focused, weary, quietly triumphant)"
    },
    {
      "id": "B",
      "prompt": "Character reference sheet: young person in their 20s with long dark hair, grey t-shirt and jeans — front view, side view, three expressions (bored, curious, delighted)"
    }
  ],
  "scenes": [
    { "id": 1, "label": "Hook", "vo": "Reading is to the mind what exercise is to the body, wrote Joseph Addison, in seventeen eleven.", "prompt": "Elegant serif quotation text centered on a clean white card, small minimalist book logo beneath, static title card", "characters": [], "motion": "static title card, gentle fade in", "min_seconds": 5 },
    { "id": 2, "label": "Hook", "vo": "While most people dread a prison sentence, one young inmate in 1946 found something unexpected behind bars: his university.", "prompt": "1940s prison cell interior, young man in denim prison uniform sitting on a bunk holding an open book that glows faintly, moonlight through barred window, muted blue-grey palette", "characters": ["A"], "motion": "slow push-in, subtle animation flicker" },
    { "id": 3, "label": "Hook", "vo": "Frustrated that he couldn't express himself in letters, Malcolm Little set himself an impossible task: copying out the entire dictionary, page by page.", "prompt": "Man at tiny prison desk copying from an enormous dictionary, handwritten pages piling up around him in drifts like snow, warm lamplight", "characters": ["A"], "motion": "slow lateral tracking" },
    { "id": 4, "label": "Hook", "vo": "From there he devoured history, philosophy, science — reading in the library, in his bunk, in every spare minute.", "prompt": "Three-panel montage: man reading in a prison library aisle, reading cross-legged on a bunk, reading at a mess hall table, warm muted tones", "characters": ["A"], "motion": "cross-dissolve between panels" },
    { "id": 5, "label": "Hook", "vo": "But the prison had one strict rule: lights out at ten. And Malcolm was never ready to stop.", "prompt": "Close-up of man's face in near darkness lit by a thin strip of corridor light, guard silhouette approaching in background hallway, high contrast, suspenseful", "characters": ["A"], "motion": "static, guard shadow slowly grows" },
    { "id": 6, "label": "Bridge", "vo": "Few of us will ever read with that kind of hunger. But research suggests even a modest daily reading habit can measurably change your brain.", "prompt": "Young person slouched on couch scrolling phone, dusty unread book on coffee table, cool desaturated tones, question mark thought bubble forming", "characters": ["B"], "motion": "static, thought bubble blooms" },
    { "id": 7, "label": "Mechanism", "vo": "The effects begin within minutes. In one widely cited study, just six minutes of reading reduced stress levels by more than two-thirds.", "prompt": "Young person opening a book on a couch, jagged red scribble above their head transforming into a smooth calm blue wave, shoulders relaxing", "characters": ["B"], "motion": "scribble morphs into wave" },
    { "id": 8, "label": "Mechanism", "vo": "As your eyes track the words, a network of brain regions lights up together — decoding symbols, conjuring images, simulating the story as if you were living it.", "prompt": "Side profile of young person reading, glowing blue circles over brain regions, tiny imagined scenes of a ship and a storm floating above the open book", "characters": ["B"], "motion": "circles pulse gently, imagined scenes drift upward" },
    { "id": 9, "label": "Mechanism", "vo": "Reading fiction in particular is thought to exercise theory of mind — your ability to model what other people think and feel.", "prompt": "Young person reading while translucent story characters — a knight, an elderly woman, a child — step out of the book, oversized empty shoes lined up on the floor", "characters": ["B"], "motion": "ghostly characters step out of the pages" },
    { "id": 10, "label": "Mechanism", "vo": "Within weeks, the habit leaves physical traces. One study found reading a novel increased connectivity in the brain's language cortex — changes that lingered for days.", "prompt": "Stylized brain drawn as a city road map at night, new glowing routes lighting up and staying lit, book pages turning in the foreground corner", "characters": [], "motion": "roads light up one by one" },
    { "id": 11, "label": "Mechanism", "vo": "Every new word you meet gets filed away — and readers encounter far more rare words in print than in everyday conversation.", "prompt": "Cute personified brain character wearing a librarian cardigan, stamping word cards and filing them into a towering card catalog, warm yellows", "characters": [], "motion": "brisk stamping and filing loop" },
    { "id": 12, "label": "Mechanism", "vo": "Sustained reading also trains something increasingly rare: deep, unbroken attention. Like a muscle, focus strengthens with use.", "prompt": "Young person reading inside a glowing protective bubble at a desk, notification bell icons bouncing off the bubble like insects", "characters": ["B"], "motion": "slow pan right, bells ricochet" },
    { "id": 13, "label": "Mechanism", "vo": "And over decades the payoff compounds. Research links lifelong reading to slower memory decline in old age — building what scientists call cognitive reserve.", "prompt": "Elderly man reading in an armchair, bookshelf behind him stacking like fortress bricks into a protective wall around the silhouette of a head, earthy warm tones", "characters": ["A"], "motion": "bricks stack upward steadily" },
    { "id": 14, "label": "Mechanism", "vo": "Simply put, reading is exercise for your brain. No equipment, no membership, no minimum fitness level. A library card will do.", "prompt": "Young person walking past gym equipment — dumbbells, treadmill, yoga mats — picking up a small glowing golden library card", "characters": ["B"], "motion": "lateral tracking walk" },
    { "id": 15, "label": "Application", "vo": "And forget the guilt of unfinished reading challenges. Studies suggest any increase in reading time yields benefits. A chapter counts. A page counts.", "prompt": "Giant cracked trophy labeled 52 toppling over, young person calmly picking up one glowing page from the debris, playful tone", "characters": ["B"], "motion": "trophy topples, handheld shake" },
    { "id": 16, "label": "Application", "vo": "Minutes hide everywhere: an audiobook on the commute, a chapter with morning coffee, a few pages in a waiting line.", "prompt": "Three-panel montage: person with headphones on a bus, person reading with steaming coffee at sunrise, person reading an e-reader in a queue, pastel palette", "characters": ["B"], "motion": "cross-dissolve between panels" },
    { "id": 17, "label": "Application", "vo": "In communities rich with libraries, bookstores, and little reading nooks, those minutes accumulate almost effortlessly.", "prompt": "Vibrant pastel city street with sidewalk book stalls, sunlit library, children reading under a leafy tree, cozy book cafe, the most colorful saturated scene, young person strolling with a book under their arm", "characters": ["B"], "motion": "slow lateral tracking through the street" },
    { "id": 18, "label": "Application", "vo": "Reading before bed, reading to your kids, reading with friends — each has its own ripple effects.", "prompt": "Split screen three panels: person reading in bed by warm lamplight, parent reading a picture book to a delighted toddler, cozy book club laughing around a table with a dog, warm lighting", "characters": ["B"], "motion": "panels slide in one by one" },
    { "id": 19, "label": "Application", "vo": "Children read to daily may hear over a million more words by age five. And one study found adults in shared reading groups felt measurably less lonely.", "prompt": "Words spiraling from an open bedtime storybook into a small galaxy above a child's head, people below connected by warm glowing threads, saturated warm colors", "characters": [], "motion": "words spiral upward into galaxy" },
    { "id": 20, "label": "Obstacle", "vo": "So why doesn't everyone just read more? For one, our attention has never been under heavier siege.", "prompt": "Young person opening a book while a grey tornado of notification icons swirls around them, glowing phone pulling their gaze, desaturated grey palette", "characters": ["B"], "motion": "icon tornado swirls" },
    { "id": 21, "label": "Obstacle", "vo": "In the United States, the share of people who read for pleasure on a given day has fallen by roughly a third since the early two-thousands.", "prompt": "Staircase built of stacked books descending like a declining bar chart, small figure standing at the bottom looking up, harsh grey lighting, high contrast", "characters": ["B"], "motion": "slow tilt down the staircase" },
    { "id": 22, "label": "Obstacle", "vo": "Meanwhile many communities have become book deserts, as library budgets shrink and local bookstores close.", "prompt": "Officials in suits wheeling a giant piggy bank away from a public library going dark window by window, bookstore with a swinging CLOSED sign, cool grey palette", "characters": [], "motion": "library windows go dark one by one" },